{
  "$schema": "./universal-macro-translation.schema.json",
  "$schema_version": "1.0",
  "version": "3.3",
  "name": "Universal macro translation — cross-SDK conformance fixtures",
  "spec_reference": "docs/creative/universal-macros.mdx#implementing-translation-with-the-sdk",
  "description": "Language-neutral golden vectors for ratified producer-side universal-macro translation behavior, including typed rejection cases and the complete successful result shape.",
  "ordering": {
    "dropped_params": "Query-parameter occurrence order; repeated keys remain repeated.",
    "unmapped_macros": "First occurrence in query order, deduplicated.",
    "dropped_consent_macros": "First occurrence in query order, deduplicated subset of unmapped_macros.",
    "frozen_consent_macros": "Mapping property order, deduplicated consent macros supplied through value entries.",
    "suspect_native_values": "Mapping property order, deduplicated. JSON fixture consumers MUST preserve the mapping order shown here."
  },
  "vectors": [
    {
      "name": "value-reserved-characters",
      "input_pixel_url": "https://pixel.example/i?v={VALUE}",
      "mapping": { "{VALUE}": { "value": "/?&=% {}#" } },
      "expected": {
        "url": "https://pixel.example/i?v=%2F%3F%26%3D%25%20%7B%7D%23",
        "dropped_params": [],
        "unmapped_macros": [],
        "dropped_consent_macros": [],
        "frozen_consent_macros": [],
        "suspect_native_values": []
      }
    },
    {
      "name": "value-unreserved-characters",
      "input_pixel_url": "https://pixel.example/i?v={VALUE}",
      "mapping": { "{VALUE}": { "value": "AZaz09-._~" } },
      "expected": {
        "url": "https://pixel.example/i?v=AZaz09-._~",
        "dropped_params": [],
        "unmapped_macros": [],
        "dropped_consent_macros": [],
        "frozen_consent_macros": [],
        "suspect_native_values": []
      }
    },
    {
      "name": "value-non-ascii-utf8",
      "input_pixel_url": "https://pixel.example/i?store={STORE_ID}",
      "mapping": { "{STORE_ID}": { "value": "café" } },
      "expected": {
        "url": "https://pixel.example/i?store=caf%C3%A9",
        "dropped_params": [],
        "unmapped_macros": [],
        "dropped_consent_macros": [],
        "frozen_consent_macros": [],
        "suspect_native_values": []
      }
    },
    {
      "name": "native-token-forms-inserted-verbatim",
      "input_pixel_url": "https://pixel.example/i?a={A}&b={B}&c={C}&d={D}",
      "mapping": {
        "{A}": { "native": "%%TOKEN%%" },
        "{B}": { "native": "{{token}}" },
        "{C}": { "native": "${token}" },
        "{D}": { "native": "[TOKEN]" }
      },
      "expected": {
        "url": "https://pixel.example/i?a=%%TOKEN%%&b={{token}}&c=${token}&d=[TOKEN]",
        "dropped_params": [],
        "unmapped_macros": [],
        "dropped_consent_macros": [],
        "frozen_consent_macros": [],
        "suspect_native_values": []
      }
    },
    {
      "name": "multiple-mapped-macros-in-one-parameter",
      "input_pixel_url": "https://pixel.example/i?ids=pre-{A}-{B}-{A}",
      "mapping": {
        "{A}": { "value": "a/b" },
        "{B}": { "native": "%%B%%" }
      },
      "expected": {
        "url": "https://pixel.example/i?ids=pre-a%2Fb-%%B%%-a%2Fb",
        "dropped_params": [],
        "unmapped_macros": [],
        "dropped_consent_macros": [],
        "frozen_consent_macros": [],
        "suspect_native_values": []
      }
    },
    {
      "name": "mapped-plus-unmapped-drops-whole-parameter",
      "input_pixel_url": "https://pixel.example/i?ids={MEDIA_BUY_ID}-{UNKNOWN}&literal=keep",
      "mapping": { "{MEDIA_BUY_ID}": { "value": "mb_1" } },
      "expected": {
        "url": "https://pixel.example/i?literal=keep",
        "dropped_params": ["ids"],
        "unmapped_macros": ["{UNKNOWN}"],
        "dropped_consent_macros": [],
        "frozen_consent_macros": [],
        "suspect_native_values": []
      }
    },
    {
      "name": "repeated-keys-and-first-seen-report-order",
      "input_pixel_url": "https://pixel.example/i?first={Z}&same={A}&same={Z}&mix={B}{A}&ok=1",
      "mapping": {},
      "expected": {
        "url": "https://pixel.example/i?ok=1",
        "dropped_params": ["first", "same", "same", "mix"],
        "unmapped_macros": ["{Z}", "{A}", "{B}"],
        "dropped_consent_macros": [],
        "frozen_consent_macros": [],
        "suspect_native_values": []
      }
    },
    {
      "name": "privacy-drops-and-deduplicated-order",
      "input_pixel_url": "https://pixel.example/i?g={GPP_STRING}&u={US_PRIVACY}&g2={GPP_STRING}&c={GDPR_CONSENT}",
      "mapping": {},
      "expected": {
        "url": "https://pixel.example/i",
        "dropped_params": ["g", "u", "g2", "c"],
        "unmapped_macros": ["{GPP_STRING}", "{US_PRIVACY}", "{GDPR_CONSENT}"],
        "dropped_consent_macros": ["{GPP_STRING}", "{US_PRIVACY}", "{GDPR_CONSENT}"],
        "frozen_consent_macros": [],
        "suspect_native_values": []
      }
    },
    {
      "name": "privacy-native-mappings-allowed",
      "input_pixel_url": "https://pixel.example/i?g={GPP_STRING}&u={US_PRIVACY}&c={GDPR_CONSENT}",
      "mapping": {
        "{GPP_STRING}": { "native": "%%GPP_STRING%%" },
        "{US_PRIVACY}": { "native": "%%US_PRIVACY%%" },
        "{GDPR_CONSENT}": { "native": "%%GDPR_CONSENT%%" }
      },
      "expected": {
        "url": "https://pixel.example/i?g=%%GPP_STRING%%&u=%%US_PRIVACY%%&c=%%GDPR_CONSENT%%",
        "dropped_params": [],
        "unmapped_macros": [],
        "dropped_consent_macros": [],
        "frozen_consent_macros": [],
        "suspect_native_values": []
      }
    },
    {
      "name": "additional-consent-native-with-tcf",
      "input_pixel_url": "https://pixel.example/i?gdpr={GDPR}&gdpr_consent={GDPR_CONSENT_755}&addtl_consent={ADDTL_CONSENT}",
      "mapping": {
        "{GDPR}": { "native": "${GDPR}" },
        "{GDPR_CONSENT_755}": { "native": "${GDPR_CONSENT_755}" },
        "{ADDTL_CONSENT}": { "native": "${ADDTL_CONSENT}" }
      },
      "expected": {
        "url": "https://pixel.example/i?gdpr=${GDPR}&gdpr_consent=${GDPR_CONSENT_755}&addtl_consent=${ADDTL_CONSENT}",
        "dropped_params": [],
        "unmapped_macros": [],
        "dropped_consent_macros": [],
        "frozen_consent_macros": [],
        "suspect_native_values": []
      }
    },
    {
      "name": "additional-consent-existing-native-pass-through",
      "input_pixel_url": "https://pixel.example/i?c=${GDPR_CONSENT_755}&a=${ADDTL_CONSENT}",
      "mapping": {},
      "expected": {
        "url": "https://pixel.example/i?c=${GDPR_CONSENT_755}&a=${ADDTL_CONSENT}",
        "dropped_params": [],
        "unmapped_macros": [],
        "dropped_consent_macros": [],
        "frozen_consent_macros": [],
        "suspect_native_values": []
      }
    },
    {
      "name": "additional-consent-unmapped-reported",
      "input_pixel_url": "https://pixel.example/i?c={GDPR_CONSENT_755}&a={ADDTL_CONSENT}&again={ADDTL_CONSENT}",
      "mapping": { "{GDPR_CONSENT_755}": { "native": "${GDPR_CONSENT_755}" } },
      "expected": {
        "url": "https://pixel.example/i?c=${GDPR_CONSENT_755}",
        "dropped_params": ["a", "again"],
        "unmapped_macros": ["{ADDTL_CONSENT}"],
        "dropped_consent_macros": ["{ADDTL_CONSENT}"],
        "frozen_consent_macros": [],
        "suspect_native_values": []
      }
    },
    {
      "name": "additional-consent-value-reported",
      "input_pixel_url": "https://pixel.example/i?c={GDPR_CONSENT_755}&a={ADDTL_CONSENT}",
      "mapping": {
        "{GDPR_CONSENT_755}": { "native": "${GDPR_CONSENT_755}" },
        "{ADDTL_CONSENT}": { "value": "2~41.1.35~dv.21.9" }
      },
      "expected": {
        "url": "https://pixel.example/i?c=${GDPR_CONSENT_755}&a=2~41.1.35~dv.21.9",
        "dropped_params": [],
        "unmapped_macros": [],
        "dropped_consent_macros": [],
        "frozen_consent_macros": ["{ADDTL_CONSENT}"],
        "suspect_native_values": []
      }
    },
    {
      "name": "additional-consent-unavailable-empty",
      "input_pixel_url": "https://pixel.example/i?c={GDPR_CONSENT_755}&a={ADDTL_CONSENT}",
      "mapping": {
        "{GDPR_CONSENT_755}": { "native": "${GDPR_CONSENT_755}" },
        "{ADDTL_CONSENT}": { "value": "" }
      },
      "expected": {
        "url": "https://pixel.example/i?c=${GDPR_CONSENT_755}&a=",
        "dropped_params": [],
        "unmapped_macros": [],
        "dropped_consent_macros": [],
        "frozen_consent_macros": ["{ADDTL_CONSENT}"],
        "suspect_native_values": []
      }
    },
    {
      "name": "vendor-scoped-consent-existing-native-pass-through",
      "input_pixel_url": "https://pixel.example/i?c=${GDPR_CONSENT_755}",
      "mapping": {},
      "expected": {
        "url": "https://pixel.example/i?c=${GDPR_CONSENT_755}",
        "dropped_params": [],
        "unmapped_macros": [],
        "dropped_consent_macros": [],
        "frozen_consent_macros": [],
        "suspect_native_values": []
      }
    },
    {
      "name": "vendor-scoped-consent-native-preserves-id",
      "input_pixel_url": "https://pixel.example/i?gdpr={GDPR}&gdpr_consent={GDPR_CONSENT_755}",
      "mapping": {
        "{GDPR}": {
          "native": "${GDPR}"
        },
        "{GDPR_CONSENT_755}": {
          "native": "${GDPR_CONSENT_755}"
        }
      },
      "expected": {
        "url": "https://pixel.example/i?gdpr=${GDPR}&gdpr_consent=${GDPR_CONSENT_755}",
        "dropped_params": [],
        "unmapped_macros": [],
        "dropped_consent_macros": [],
        "frozen_consent_macros": [],
        "suspect_native_values": []
      }
    },
    {
      "name": "vendor-scoped-consent-other-id-preserved",
      "input_pixel_url": "https://pixel.example/i?c={GDPR_CONSENT_42}",
      "mapping": {
        "{GDPR_CONSENT_42}": {
          "native": "${GDPR_CONSENT_42}"
        }
      },
      "expected": {